{"analysis_input_id":"019c1234-0000-7000-8000-000000000001","analysis_output_id":"019c1234-0000-7000-8000-000000000002","claims":[{"citations":["/evidence/strategy/decisions/0/disposition","/evidence/strategy/decisions/0/confidence"],"claim_id":"claim-1","kind":"explanation","text":"The deterministic strategy state marks the setup as a candidate with confidence 0.81."},{"citations":["/evidence/risk","/evidence/decision/availability"],"claim_id":"claim-2","kind":"attention_guidance","text":"Risk is absent and the decision stage is not implemented, so this explanation supplies no trading authority."}],"evidence_digest":"28bf3b99c953c94eaa5ca5b9f8d48c83b495445cd327f0be61ee5c60eee81c6c","limitations":["advisory_only","single_snapshot_only","risk_unavailable","decision_unavailable"],"purpose":"strategy_explanation","schema_version":"ai_analysis_output.v1","snapshot_id":"019849d1-8c00-7000-8000-000000000001","status":"available","summary":"The snapshot contains a deterministic strategy candidate, but no risk assessment or implemented decision state.","unavailable_reason":null}
