{"analysis_input_id":"019c1234-0000-7000-8000-000000000001","analysis_output_id":"019c1234-0000-7000-8000-000000000005","claims":[],"evidence_digest":"28bf3b99c953c94eaa5ca5b9f8d48c83b495445cd327f0be61ee5c60eee81c6c","limitations":[],"purpose":"strategy_explanation","schema_version":"ai_analysis_output.v1","snapshot_id":"019849d1-8c00-7000-8000-000000000001","status":"unavailable","summary":null,"unavailable_reason":"provider_timeout"}
